{
  "$schema": "./translation-verifier-model-allocation.schema.json",
  "schemaVersion": "1.0",
  "status": "proposed-not-implemented",
  "scope": "Translation-verifier responsibility allocation: two model profiles, three isolated model roles, and host-owned execution and release gates. This record does not activate routing, grant permissions, or change production verification contracts.",
  "references": [
    "docs/superpowers/translation-verifier-latency-analysis.md",
    "docs/superpowers/translation-verifier-fileupload-baseline.md",
    "services/translation-verifier/e2e/fileupload-datasets.json"
  ],
  "evidenceLimits": [
    "The small C# to Java low-effort samples completed faster, but case sets and verification effectiveness were not controlled.",
    "The FileUpload high-effort request ended with a connection failure before business tests executed; it provides neither a successful latency baseline nor a model defect-detection score.",
    "Agent session time includes network, orchestration, tools and output generation; it is not a measurement of reasoning time alone.",
    "No specific model profile or latency target in this proposal has been qualified for production."
  ],
  "modelProfiles": {
    "strong-reasoning": {
      "selectionStatus": "pending-benchmark",
      "selectedModel": null,
      "experimentalCandidate": null,
      "effortPolicy": "Use a qualified strong model for independent verification design and unresolved semantic interpretation. Allocate higher reasoning effort to complex state, failure, security or data-integrity obligations; do not assume provider effort labels have identical behavior.",
      "selectionCriteria": [
        "Low required-obligation omission rate",
        "Correct requirement-grounded oracles, including source-only and common-mode defects",
        "Evidence-grounded interpretation without weakening approved obligations",
        "Completion rate, latency and cost on permitted enterprise providers and held-out tasks"
      ]
    },
    "fast-code": {
      "selectionStatus": "pending-benchmark",
      "selectedModel": null,
      "experimentalCandidate": {
        "model": "deepseek-v4-flash",
        "requestedEffort": "low",
        "qualification": "Experimental starting point only. Existing low-effort measurements do not establish FileUpload effectiveness or production reliability; the client setting alone is not provider acknowledgment."
      },
      "effortPolicy": "Start with low effort for bounded test implementation using frozen obligations, known build commands and existing drivers. Skip model calls when approved tests and adapters already suffice.",
      "selectionCriteria": [
        "First-attempt executable tests using real project APIs",
        "Faithful implementation of frozen assertions and required observations",
        "Few harness repair attempts without modifying production code or validation policy",
        "Independently replay-confirmed defect detection, completion rate, latency and cost"
      ]
    }
  },
  "stages": [
    {
      "id": "preflight",
      "owner": "host",
      "modelProfile": null,
      "dependsOn": [],
      "runWhen": "Every request, before expensive model or build work.",
      "inputs": ["Approved candidate and request", "Language route and required validation policy", "Permissions and total request budget"],
      "outputs": ["Capability and toolchain availability", "Validated scope and permission boundaries", "Deadline or explicit unavailable-capability result"],
      "allowedActions": ["Check actual runtimes, dependencies and supported commands", "Fail closed when required capabilities are unavailable"],
      "forbiddenActions": ["Silently fall back to mocks", "Ask a model to invent missing capabilities", "Treat missing infrastructure as a target behavioral defect"]
    },
    {
      "id": "freeze-context",
      "owner": "host",
      "modelProfile": null,
      "dependsOn": ["preflight"],
      "runWhen": "After candidate selection; before translation-dependent verification.",
      "inputs": ["Source implementation bundle", "Original target context", "Requirements, approved decisions and trusted existing tests"],
      "outputs": ["Versioned and hashed evidence snapshots", "Build facts, legal public API invocation and existing test inventory"],
      "allowedActions": ["Collect facts using existing project and language tooling", "Use optional bounded fast-model assistance to locate relevant context, then verify cited facts"],
      "forbiddenActions": ["Treat translator conclusions as independent proof", "Stage benchmark labels or hidden oracles in model workspaces", "Modify user source files"]
    },
    {
      "id": "design-obligations",
      "owner": "verification-designer",
      "modelProfile": "strong-reasoning",
      "dependsOn": ["freeze-context"],
      "runWhen": "Approved reusable obligations do not cover the current requirements and scope; otherwise reuse the unchanged approved artifact.",
      "inputs": ["Frozen requirements and human decisions", "Source evidence and original target APIs", "Trusted existing tests and verified engineering facts"],
      "outputs": ["Proposed obligations with IDs, provenance, required flags, inputs, observations and oracle rules", "Coverage mapping to existing tests", "Ambiguities requiring human confirmation"],
      "allowedActions": ["Design independent requirements-based assertions", "Identify allowed differences already supported by the contract", "Request clarification for unsupported assumptions"],
      "forbiddenActions": ["Infer correctness solely from source or generated target outputs", "Use final translation code to weaken core obligations", "Approve its own ambiguous requirement interpretations"]
    },
    {
      "id": "freeze-obligations",
      "owner": "host",
      "modelProfile": null,
      "dependsOn": ["design-obligations"],
      "runWhen": "Before new test implementation or reuse; unresolved requirement ambiguities block the affected obligations.",
      "inputs": ["Proposed or reusable verification obligations", "Required human approvals and fixed validation policy"],
      "outputs": ["Frozen, versioned obligations and approved comparison rules", "Executable checks or explicit gaps requiring test implementation"],
      "allowedActions": ["Validate structure, references, policy coverage and required approvals", "Bind obligation identity to requirements and evidence snapshots"],
      "forbiddenActions": ["Treat structural schema validity as proof that an oracle is semantically correct", "Automatically approve model-proposed requirement waivers"]
    },
    {
      "id": "implement-tests",
      "owner": "test-builder",
      "modelProfile": "fast-code",
      "dependsOn": ["freeze-obligations"],
      "runWhen": "Existing trusted tests and approved drivers do not cover frozen obligations. Source drivers and target API adapters may be prepared alongside translation.",
      "inputs": ["Frozen obligations and trusted tests", "Approved driver templates and writable test paths", "Verified construction, invocation, dependency and build facts"],
      "outputs": ["Source and target test drivers", "Obligation-to-test and observation mapping", "Test file hashes and unresolved implementation gaps"],
      "allowedActions": ["Write new tests only within host-authorized isolated paths", "Repair test syntax, imports and invocation mistakes without weakening assertions"],
      "forbiddenActions": ["Modify production implementations, existing acceptance tests or build verification policy", "Change expected values to match observed failures", "Skip required cases or swallow exceptions to obtain pass", "Use reflection to bypass required public API access"]
    },
    {
      "id": "instantiate-target",
      "owner": "host",
      "modelProfile": null,
      "dependsOn": ["freeze-context"],
      "runWhen": "The translator supplies a final patch, and again for each approved repair patch.",
      "inputs": ["Frozen original target context", "Authorized patch and patch hash"],
      "outputs": ["Isolated patched target workspace", "Final API and dependency facts or detected incompatibilities"],
      "allowedActions": ["Apply the patch within approved boundaries", "Check final implementation against frozen API and dependency constraints"],
      "forbiddenActions": ["Modify the real user workspace during verification", "Reuse target execution evidence for a different patch hash"]
    },
    {
      "id": "execute-evidence",
      "owner": "host",
      "modelProfile": null,
      "dependsOn": ["implement-tests", "instantiate-target"],
      "runWhen": "Required tests or approved reusable equivalents are ready. Source-only build and execution may be prepared earlier when all source-side inputs are fixed.",
      "inputs": ["Frozen obligations and mapped tests", "Isolated source and final target workspaces", "Host-approved commands, budgets and input generators"],
      "outputs": ["Build and test outcomes", "Case-linked raw outputs, command IDs and artifact hashes", "Returned values, output bytes, state transitions, resource and exception observations", "Timeouts and infrastructure failures"],
      "allowedActions": ["Run existing tests and bounded property or generated-input exploration", "Capture evidence and minimize counterexamples", "Validate generated test mappings and observation completeness", "Terminate process trees at deadlines"],
      "forbiddenActions": ["Trust model-authored execution claims without actual records", "Run untrusted generated tests outside isolation", "Treat zero process exit status as proof that every required assertion ran"]
    },
    {
      "id": "evaluate-mechanically",
      "owner": "host",
      "modelProfile": null,
      "dependsOn": ["execute-evidence"],
      "runWhen": "Execution finishes or terminates; preserve partial and missing evidence explicitly.",